,NAME,GEOCODE_INPUT,LAT,LNG,TYPE
200,Hospital Municipal de Natal,"Hospital Municipal de Natal, Petrópolis, Rua Cel. Joaquim Manoel, 654",-5.7826943,-35.1967178,Unidade de Saúde
201,CENTRO DE REF DE ATENCAO AO IDOSO,"CENTRO DE REF DE ATENCAO AO IDOSO, Ribeira, Praça Augusto Severo, 281",,,Unidade de Saúde
202,CAPS AD Leste,"CAPS AD Leste, Barro Vermelho, Rua Pacifico de Medeiros, 1251",-5.788198899999999,-35.20241620000001,Unidade de Saúde
203,CAPS III Leste,"CAPS III Leste, Petrópolis, Rua Mipibu",-5.7858613,-35.2018556,Unidade de Saúde
204,CEO Morton Mariz,"CEO Morton Mariz, Ribeira, Praça Cap José da Penha, 155",-5.7773366,-35.203945,Unidade de Saúde
205,Centro de Especialidades Integradas Leste II,"Centro de Especialidades Integradas Leste II, Ribeira, Rua Fonseca e Silva, 1229",-5.7938868,-35.2153725,Unidade de Saúde
206,Residencia Terapeutica I,"Residencia Terapeutica I, Tirol, Rua Dr. Inacio de Carvalho, 1119",,,Unidade de Saúde
207,USB Lagoa Seca,"USB Lagoa Seca, Lagoa Seca, R Padre Antônio, 169",-5.809238400000001,-35.2128593,Unidade de Saúde
208,USB Familiar Comunitária,"USB Familiar Comunitária, Petrópolis, Av. Nilo Peçanha, 620",,,Unidade de Saúde
209,UBS São João,"UBS São João, Tirol, Av. Romualdo Galvão, 891",-5.8012958,-35.2040499,Unidade de Saúde
210,UBS Alecrim,"UBS Alecrim, Alecrim, Avenida PresidenteBandeira, 935",-5.8046905,-35.2137679,Unidade de Saúde
211,UBS Mãe Luiza,"UBS Mãe Luiza, Mãe Luíza, Rua João XXII, 2A",,,Unidade de Saúde
212,USF Planalto,"USF Planalto, Planalto, Av. Comunidade Shallon 10 -  Coophab",,,Unidade de Saúde
213,USF Ponta Negra,"USF Ponta Negra, Ponta Negra, Rua José Medeiros, 01",,,Unidade de Saúde
214,Policlínica Sul,"Policlínica Sul, Neópolis, RUA. RIO JUCUI, 96",,,Unidade de Saúde
215,Maternidade de Natal ,"Maternidade de Natal , Tirol, Rua Cel. Joventino Cabral, 1734",,,Unidade de Saúde
216,Unidade Mista de Cidade Satélite,"Unidade Mista de Cidade Satélite, Pitimbu, Rua das Carnaubas, s/nº",-5.8685455,-35.2241325,Unidade de Saúde
217,UPA Satélite,"UPA Satélite, Pitimbu, Av. dos Xavantes, s/n – Cid. Satélite",-5.8685455,-35.2241325,Unidade de Saúde
218,Residencia TerapêuticaIII,"Residencia TerapêuticaIII, Pitimbu, R. Comandante Monteiro Chaves, 2053",,,Unidade de Saúde
219,UBS CIDADE SATELITE,"UBS CIDADE SATELITE, Pitimbu, Rua Serra do Piracambu, 02",-5.8582019,-35.241673,Unidade de Saúde
220,UBS Satélite,"UBS Satélite, Pitimbu, Rua das Carnaúbas, 02",-5.8582019,-35.241673,Unidade de Saúde
221,UBS Jiqui,"UBS Jiqui, Neópolis, Rua União dos Palmeiras, 11, Jiqui",-5.865338899999999,-35.2086124,Unidade de Saúde
222,UBS Nova Descoberta,"UBS Nova Descoberta, Nova Descoberta, Av. Xavier da Silveira, 05",-5.8255551,-35.20364259999999,Unidade de Saúde
223,UBS Pirangi,"UBS Pirangi, Neópolis, AV. SÃO MIGUEL DOS CARIBES, 4650",,,Unidade de Saúde
224,UBS Candelária,"UBS Candelária, Candelária, Rua Nossa Senhora da Candelária, 3042",,,Unidade de Saúde
225,UBS Mirassol,"UBS Mirassol, Capim Macio, Rua das Violetas, s/nº -Mirassol",,,Unidade de Saúde
226,Sede Dist. Sant. Norte I,"Sede Dist. Sant. Norte I, Potengi, Rua Ivaiporão, 133, Conj. Santarém",,,Unidade de Saúde
227,Sede Dist. Sant. Norte II,"Sede Dist. Sant. Norte II, Igapó, Rua Marcilio Dias, 265",,,Unidade de Saúde
228,Sede Dist. Sant. Leste,"Sede Dist. Sant. Leste, Ribeira, Pça. Augusto Severo, 281",,,Unidade de Saúde
229,Sede Dist. Sant. Sul,"Sede Dist. Sant. Sul, Nova Descoberta, Avenida Amintas Barros, 4549",,,Unidade de Saúde
230,Sede Dist. Sant. Oeste,"Sede Dist. Sant. Oeste, Bom Pastor, Rua Rubens Mariz, 10 ",,,Unidade de Saúde
231,PRONTO ATENDIMENTO INFANTIL SANDRA CELESTE,"PRONTO ATENDIMENTO INFANTIL SANDRA CELESTE, Lagoa Nova, AV. JAGUARARI, 2574",-5.8281145,-35.2219302,Unidade de Saúde
